<?xml version="1.0" encoding="UTF-8" standalone="yes"?>
<xs:schema version="1.0" xmlns:xs="http://www.w3.org/2001/XMLSchema">
    <xs:include schemaLocation="../global_types.xsd"/>
    <xs:include schemaLocation="../import.xsd"/>
    <xs:element name="guild_donation_templates">
        <xs:complexType>
            <xs:sequence>
                <xs:element name="guild_donation_template" type="GuildDonationTemplate" minOccurs="0" maxOccurs="unbounded"/>
            </xs:sequence>
        </xs:complexType>
    </xs:element>
    <xs:complexType name="GuildDonationTemplate">
        <xs:sequence>
            <xs:element name="guild_donation_component" type="GuildDonationComponent" minOccurs="0" maxOccurs="unbounded"/>
        </xs:sequence>
        <xs:attribute name="id" type="xs:int" use="required"/>
        <xs:attribute name="name" type="xs:string" use="optional"/>
    </xs:complexType>
    <xs:complexType name="GuildDonationComponent">
        <xs:attribute name="index" type="xs:int" use="required"/>
        <xs:attribute name="item_id" type="xs:int" use="required"/>
        <xs:attribute name="quantity" type="xs:int" use="required"/>
        <xs:attribute name="contribution" type="xs:int" use="required"/>
        <xs:attribute name="reward_coin" type="xs:int" use="required"/>
    </xs:complexType>
</xs:schema>